{
  "schema_version": "deedseal.public-evidence-record/v1",
  "id": "EVD-OFFICE-0004",
  "component": "OFFICE",
  "source_snapshot": "OFFICE-2026-08-12-A",
  "observed_on": "2026-08-12",
  "kind": "sanitized-live-grant-binding-correction-observation",
  "assurance": "internal-ci-attestation",
  "verification": {
    "verdict": "PASS",
    "observations": [
      {
        "check": "byte-distance",
        "result": "the prompt bytes covered by the signed grant and the prompt bytes transmitted to the broker differed by exactly one byte, introduced by shell normalization of a trailing newline"
      },
      {
        "check": "refusal",
        "result": "the broker refused the request because the grant did not cover the transmitted bytes; no completion was accepted"
      },
      {
        "check": "boundary-was-correct",
        "result": "the refusal was correct on both attempts; the defect was in the caller, and no boundary was relaxed to admit it"
      },
      {
        "check": "correction",
        "result": "one normalized prompt file is now computed once and consumed by both the grant leg and the transmitting leg, so the two legs cannot disagree about a byte"
      },
      {
        "check": "frozen-source-digest",
        "result": "sha256 c30ca5c25d8eeed5e058572d5aed60114ffbc5e48f412676308bdc3165848f86 over the frozen ceremony-driver source artifact"
      }
    ]
  },
  "disclosure": {
    "source_visibility": "private",
    "redactions": [
      "R-IP",
      "R-OPS",
      "R-PRIV",
      "R-SEC",
      "R-VULN"
    ],
    "omitted": [
      "private source coordinates, repository and change identifiers, and internal file paths",
      "host, machine, account, kernel, socket and transport identities",
      "raw grants, prompt bytes, completion bodies and refusal receipts",
      "exact configured limits, exact refusal codes and unpublished schema detail"
    ]
  },
  "limitations": [
    "The observation covers one grant-to-transmission mismatch and its correction. It does not establish that every byte-level divergence in the path is detected.",
    "A single shared byte source removes one class of disagreement between the two legs. It is not a proof of end-to-end byte custody.",
    "The SHA-256 values in this record bind this public sanitized record and the named frozen source artifacts only. They do not bind private source truth, do not establish immutability, and are not independent certification.",
    "This is a sanitized internal attestation over a frozen private source snapshot. It is not independently reproducible, is not independently reviewed, and is not independently audited.",
    "No customer-grade capability, no customer deployment, and no accepted candidate output is claimed by this record."
  ]
}
