{
  "schema_version": "deedseal.public-evidence-record/v1",
  "id": "EVD-OFFICE-0005",
  "component": "OFFICE",
  "source_snapshot": "OFFICE-2026-08-12-A",
  "observed_on": "2026-08-12",
  "kind": "sanitized-live-false-green-correction-observation",
  "assurance": "internal-ci-attestation",
  "verification": {
    "verdict": "PASS",
    "observations": [
      {
        "check": "defect-observed",
        "result": "a live call showed the retrieval client reading the completion from a response field the installed broker does not populate, so an answer that had already been paid for was discarded"
      },
      {
        "check": "test-double-defect",
        "result": "the focused suite's in-process broker double answered in the same wrong shape, so the suite reported every check passing over a client that could not work against the installed broker"
      },
      {
        "check": "false-green-preserved",
        "result": "the passing result recorded before the correction was not evidence of a working client; this record preserves that the green was false rather than restating the suite's own verdict"
      },
      {
        "check": "correction",
        "result": "the client and its test double were both changed to the response shape the installed broker actually returns, so the double's fidelity to the real component is what the suite now depends on"
      },
      {
        "check": "frozen-source-digest",
        "result": "sha256 b2483ccd2ebed67abf840c2b2e90e633e08b4641f111f2a8e67e70de56ba252f over the frozen retrieval-client source artifact, and sha256 ab8ea1be8107880e942d639972d633f8d9488398044d94dddd712b9fecd2aa0b over the frozen focused-suite source artifact"
      }
    ]
  },
  "disclosure": {
    "source_visibility": "private",
    "redactions": [
      "R-IP",
      "R-OPS",
      "R-PRIV",
      "R-SEC"
    ],
    "omitted": [
      "private source coordinates, repository and change identifiers, and internal file paths",
      "host, machine, account, kernel, socket and transport identities",
      "raw grants, prompt bytes, completion bodies and refusal receipts",
      "exact configured limits, exact refusal codes and unpublished schema detail"
    ]
  },
  "limitations": [
    "The correction removes one observed disagreement between a test double and the component it stands in for. It does not establish that the double is faithful in any other respect.",
    "That a live path exposed this defect is a statement about this defect. It does not establish that live execution will expose the next one.",
    "The SHA-256 values in this record bind this public sanitized record and the named frozen source artifacts only. They do not bind private source truth, do not establish immutability, and are not independent certification.",
    "This is a sanitized internal attestation over a frozen private source snapshot. It is not independently reproducible, is not independently reviewed, and is not independently audited.",
    "No customer-grade capability, no customer deployment, and no accepted candidate output is claimed by this record."
  ]
}
