{
  "schema_version": "deedseal.public-evidence-record/v1",
  "id": "EVD-OFFICE-0006",
  "component": "OFFICE",
  "source_snapshot": "OFFICE-2026-08-12-A",
  "observed_on": "2026-08-12",
  "kind": "sanitized-live-contract-alignment-observation",
  "assurance": "internal-ci-attestation",
  "verification": {
    "verdict": "PASS",
    "observations": [
      {
        "check": "refusal",
        "result": "quarantine refused an answer returned as prose, because the committed candidate contract is loaded and enforced as a structured document"
      },
      {
        "check": "cause",
        "result": "the request described the contract in words while the loader enforced it as structure, so only one half of the handshake stated the shape"
      },
      {
        "check": "correction",
        "result": "the request now states the shape the loader enforces: the closed kind set, the proposal type rule with record types named as forbidden, the anchor and range fields, confidence, and a bounded candidate count"
      },
      {
        "check": "scope-unchanged",
        "result": "the frozen corpus, the pre-registered metrics and the truth boundary were not moved by this correction"
      },
      {
        "check": "frozen-source-digest",
        "result": "sha256 293a978023f4d124b55c58dc3ed05738f188b32727ee8cd648fa7fe2d7b630f2 over the frozen request-composer source artifact"
      }
    ]
  },
  "disclosure": {
    "source_visibility": "private",
    "redactions": [
      "R-IP",
      "R-OPS",
      "R-PRIV",
      "R-SEC",
      "R-VULN"
    ],
    "omitted": [
      "private source coordinates, repository and change identifiers, and internal file paths",
      "host, machine, account, kernel, socket and transport identities",
      "raw grants, prompt bytes, completion bodies and refusal receipts",
      "exact configured limits, exact refusal codes and unpublished schema detail"
    ]
  },
  "limitations": [
    "The observation covers one refusal of an unstructured answer and the request correction that followed. It does not establish that every malformed answer is refused.",
    "Stating the enforced shape in the request makes agreement more likely. It does not guarantee a conforming answer, and the loader remains the only thing that decides.",
    "The SHA-256 values in this record bind this public sanitized record and the named frozen source artifacts only. They do not bind private source truth, do not establish immutability, and are not independent certification.",
    "This is a sanitized internal attestation over a frozen private source snapshot. It is not independently reproducible, is not independently reviewed, and is not independently audited.",
    "No customer-grade capability, no customer deployment, and no accepted candidate output is claimed by this record."
  ]
}
