{
  "schema_version": "deedseal.public-evidence-record/v1",
  "id": "EVD-OFFICE-0003",
  "component": "OFFICE",
  "source_snapshot": "OFFICE-2026-08-12-A",
  "observed_on": "2026-08-12",
  "kind": "sanitized-live-receipt-content-observation",
  "assurance": "internal-ci-attestation",
  "verification": {
    "verdict": "PASS",
    "observations": [
      {
        "check": "receipt-content",
        "result": "the live cell receipt records brokered exchanges as digests; it carries neither the words sent nor the words returned"
      },
      {
        "check": "body-disposition",
        "result": "the disposable cell does not retain the response body, so the surviving evidence of the exchange inside the cell is its digest"
      },
      {
        "check": "retention-path",
        "result": "retaining the words for owner review required a separate bounded retrieval step that writes into quarantine, not a change to the cell"
      },
      {
        "check": "accepted-source-receipt-digest",
        "result": "sha256 5a5f14cb8a42992fbc3096e435b597e468c5ac8ac862f707d55bc70e2fada40f recorded by the accepted live-cell receipt over its own named evidence sources"
      },
      {
        "check": "frozen-source-digest",
        "result": "sha256 181a2f616cb4d357ffd79f87fd11fcf014a4c9a8d3ff166e9c43611d3a32e2ae over the frozen receipt-construction source artifact"
      }
    ]
  },
  "disclosure": {
    "source_visibility": "private",
    "redactions": [
      "R-IP",
      "R-OPS",
      "R-PRIV",
      "R-SEC"
    ],
    "omitted": [
      "private source coordinates, repository and change identifiers, and internal file paths",
      "host, machine, account, kernel, socket and transport identities",
      "raw grants, prompt bytes, completion bodies and refusal receipts",
      "exact configured limits, exact refusal codes and unpublished schema detail"
    ]
  },
  "limitations": [
    "The receipt is digest-bound, not signed. It detects drift against the bytes it covers; it does not prove that the recorded exchange happened on any particular machine, and it is not offered as forgery resistance.",
    "That a body was not retained inside the cell is a statement about the cell. It is not a statement about what any other component retains.",
    "The SHA-256 values in this record bind this public sanitized record and the named frozen source artifacts only. They do not bind private source truth, do not establish immutability, and are not independent certification.",
    "This is a sanitized internal attestation over a frozen private source snapshot. It is not independently reproducible, is not independently reviewed, and is not independently audited.",
    "No customer-grade capability, no customer deployment, and no accepted candidate output is claimed by this record."
  ]
}
