{
  "schema_version": "deedseal.public-evidence-record/v1",
  "id": "EVD-CORE-0001",
  "component": "CORE",
  "source_snapshot": "CORE-2026-08-01-A",
  "observed_on": "2026-08-01",
  "kind": "sanitized-internal-verification-summary",
  "assurance": "internal-ci-attestation",
  "verification": {
    "verdict": "PASS",
    "observations": [
      {
        "check": "canonical-product-acceptance",
        "result": "7/7 PASS"
      },
      {
        "check": "current-runpassport-contract",
        "result": "strict product verification path passed"
      },
      {
        "check": "historical-compatibility-boundary",
        "result": "12/12 QUALIFIED_PASS; current strict path unchanged"
      },
      {
        "check": "historical-boundary-hostile-probes",
        "result": "5/5 PASS"
      }
    ]
  },
  "disclosure": {
    "source_visibility": "private",
    "redactions": [
      "R-IP",
      "R-OPS",
      "R-SEC"
    ],
    "omitted": [
      "private source coordinates",
      "internal commit and workflow identifiers",
      "raw passports, grants, custody records, and logs",
      "trust material and implementation detail"
    ]
  },
  "limitations": [
    "This record is an internal verification summary, not an independently reproducible test report.",
    "PASS applies only to the opaque private snapshot named above.",
    "The checks concern authority, process, provenance, scope, custody, commit binding, and tamper evidence; they do not establish semantic correctness, product security, or release readiness."
  ]
}

